"Story","Title","Result","Date","Stability","Duration (s)"
"Dol homepage regression","Verify all of the Agencies sub-navigation tabs open correctly","SUCCESS","2017-11-22T10:32:02.770-05:00","0.0","19.09"
"Dol homepage regression","Verify all of the Footer navigation links open correctly","SUCCESS","2017-11-22T10:32:52.938-05:00","0.0","40.17"
"Dol homepage regression","Verify all of the Press sub-navigation tabs open correctly","SUCCESS","2017-11-22T10:32:21.863-05:00","0.0","31.06"
"Dol homepage regression","Verify all of the Social Media navigation links open correctly","SUCCESS","2017-11-22T10:33:33.106-05:00","0.0","71.38"
"Dol homepage regression","Verify all of the Topics sub-navigation tabs open correctly","SUCCESS","2017-11-22T10:31:33.230-05:00","0.0","29.54"
"Dol homepage regression","Verify all of the navbar tabs to assert that the pages open correctly","SUCCESS","2017-11-22T10:30:29.374-05:00","0.0","63.84"
