"Story","Title","Result","Date","Stability","Duration (s)"
"Dol homepage regression","Verify all of the Agencies sub-navigation tabs open correctly","SUCCESS","2017-11-08T13:30:12.188-05:00","0.0","18.79"
"Dol homepage regression","Verify all of the Footer navigation links open correctly","SUCCESS","2017-11-08T13:30:56.578-05:00","0.0","38.42"
"Dol homepage regression","Verify all of the Press sub-navigation tabs open correctly","SUCCESS","2017-11-08T13:30:30.989-05:00","0.0","25.58"
"Dol homepage regression","Verify all of the Social Media navigation links open correctly","SUCCESS","2017-11-08T13:31:35.009-05:00","0.0","95.21"
"Dol homepage regression","Verify all of the Topics sub-navigation tabs open correctly","SUCCESS","2017-11-08T13:29:43.400-05:00","0.0","28.78"
"Dol homepage regression","Verify all of the navbar tabs to assert that the pages open correctly","SUCCESS","2017-11-08T13:28:33.028-05:00","0.0","70.36"
