"Story","Title","Result","Date","Stability","Duration (s)"
"Dol homepage regression","Verify all of the Agencies sub-navigation tabs open correctly","SUCCESS","2017-11-30T09:50:26.640-05:00","0.0","31.26"
"Dol homepage regression","Verify all of the Footer navigation links open correctly","SUCCESS","2017-11-30T09:51:37.323-05:00","0.0","40.03"
"Dol homepage regression","Verify all of the Press sub-navigation tabs open correctly","SUCCESS","2017-11-30T09:50:57.912-05:00","0.0","39.4"
"Dol homepage regression","Verify all of the Topics sub-navigation tabs open correctly","SUCCESS","2017-11-30T09:49:54.420-05:00","0.0","32.2"
"Dol homepage regression","Verify all of the navbar tabs to assert that the pages open correctly","SUCCESS","2017-11-30T09:49:00.119-05:00","0.0","54.29"
