"Story","Title","Result","Date","Stability","Duration (s)"
"Dol homepage regression","Verify all of the Agencies sub-navigation tabs open correctly","SUCCESS","2018-02-13T20:29:05.959-05:00","0.0","23.16"
"Dol homepage regression","Verify all of the Footer navigation links open correctly","SUCCESS","2018-02-13T20:30:01.802-05:00","0.0","44.08"
"Dol homepage regression","Verify all of the Press sub-navigation tabs open correctly","SUCCESS","2018-02-13T20:29:29.121-05:00","0.0","32.68"
"Dol homepage regression","Verify all of the Social Media navigation links open correctly","FAILURE","2018-02-13T20:30:45.892-05:00","0.0","84.94"
"Dol homepage regression","Verify all of the Topics sub-navigation tabs open correctly","ERROR","2018-02-13T20:28:04.964-05:00","0.0","60.91"
"Dol homepage regression","Verify all of the navbar tabs to assert that the pages open correctly","SUCCESS","2018-02-13T20:27:08.225-05:00","0.0","56.73"
