"Story","Title","Result","Date","Stability","Duration (s)"
"Dol homepage regression","Verify all of the Agencies sub-navigation tabs open correctly","SUCCESS","2017-10-05T14:19:17.675-04:00","0.0","21.41"
"Dol homepage regression","Verify all of the Footer navigation links open correctly","SUCCESS","2017-10-05T14:19:39.093-04:00","0.0","42.78"
"Dol homepage regression","Verify all of the Press sub-navigation tabs open correctly","SKIPPED","2017-10-05T14:17:37.870-04:00","0.0","0.0"
"Dol homepage regression","Verify all of the Social Media navigation links open correctly","SUCCESS","2017-10-05T14:20:21.879-04:00","0.0","72.94"
"Dol homepage regression","Verify all of the Topics sub-navigation tabs open correctly","SUCCESS","2017-10-05T14:18:42.420-04:00","0.0","35.24"
"Dol homepage regression","Verify all of the navbar tabs to assert that the pages open correctly","SUCCESS","2017-10-05T14:17:39.561-04:00","0.0","62.85"
